<?xml version="1.0" encoding="UTF-8"?>
<!DOCTYPE rutas SYSTEM "rutas.dtd"> 
<rutas>
    <ruta nombreRuta="Rio Perdido Aventura">
        <datos>
            <tipoRuta>"Aventura"</tipoRuta>
            <transporte>"4x4"</transporte>
            <duracion>"15 dias"</duracion>
            <agencia>"Rutas 10"</agencia>
            <descripcion>"Incluir la descripcion de la ruta aqu√≠"</descripcion>
            <publico>"Todos"</publico>
            <lugarInicio>"Aereopuerto"</lugarInicio>
            <direccionInicio>"Por Completar"</direccionInicio>
            <coordenadas>
                <longitud>
                    -32.453
                </longitud>
                <latitud>
                    23.52
                </latitud>
                <altitud>
                    123.83
                </altitud>
            </coordenadas>
            <referencias>"https://www.rutas10.com/africa/botswana/ruta-perdido-aventura-botswana-cataratas-10713.html"</referencias>
            <recomendacion>8</recomendacion>

        </datos>

        <hitos>
            <hito nombreHito="hito1">
				<descripcionHito>"Lugar con vistas"</descripcionHito>
				<coordenadasHito>
					<longitud>-28.7112194</longitud>
                    <latitud>-23.534</latitud>
                    <altitud>24.76</altitud>
				</coordenadasHito>
                <distancia>"40"</distancia>
                <fotografias>
                    "foto1"
                </fotografias>
                <videos>
                    "video1"
                </videos>
			</hito>

            
        </hitos>
    </ruta>

</rutas>